{
  "schema_version": "zcr-task/1",
  "state": "active",
  "task_id": "T10",
  "workspace_id": "fs:16777232:649346710:16777232:649346708:16777232:647053195",
  "base_commit": "a15b127ccc407d5404f03196787c18625ea20d1f",
  "contract_digest": "bc75e601b8d3f6e5f5b1d52084f8cd9ca16ea81eda11c25e6c42494f5816bab6",
  "fence": 1,
  "expires_at": "2026-09-15T01:04:42Z",
  "read_paths": [
    "."
  ],
  "write_paths": [
    "src/workspace/identity.zig",
    "tests/t10_test.zig",
    "evidence/T10"
  ],
  "immutable_paths": [
    "build.zig",
    "build.zig.zon",
    "src/core",
    "contracts",
    "config",
    "AGENTS.md",
    ".github"
  ],
  "operations": [
    "read",
    "enumerate",
    "search",
    "status",
    "health"
  ],
  "max_changed_files": 32
}