{
  "schema_version": "zcr-task/1",
  "state": "planned",
  "task_id": "T04",
  "workspace_id": null,
  "base_commit": null,
  "contract_digest": null,
  "fence": null,
  "expires_at": null,
  "read_paths": [
    "src",
    "tests"
  ],
  "write_paths": [
    "src/fs/read.zig",
    "src/fs/metadata.zig",
    "tests/t04_test.zig"
  ],
  "immutable_paths": [
    "build.zig",
    "build.zig.zon",
    "src/core",
    "contracts"
  ],
  "operations": [
    "read",
    "enumerate",
    "search",
    "batch_read",
    "status",
    "health"
  ],
  "max_changed_files": 3
}
